{
  "story_id": "kissinger",
  "taxonomy_version": "0.3.0",
  "tagged_by": { "agent": "btb-tagger-blind-2", "model": "claude-opus-5-5", "date": "2026-10-16" },
  "format": "deep-dive",
  "subjects": [
    { "name": "Henry Kissinger", "kind": "person", "role": "primary", "lifespan": { "start": 1923, "end": 2023 }, "wikidata": "Q66107" },
    { "name": "Richard Nixon", "kind": "person", "role": "secondary", "lifespan": { "start": 1913, "end": 1994 }, "wikidata": "Q9588" },
    { "name": "Yahya Khan", "kind": "person", "role": "secondary", "lifespan": { "start": 1917, "end": 1980 } },
    { "name": "US bombing of Cambodia and Laos", "kind": "event", "role": "secondary" },
    { "name": "1971 Bangladesh genocide", "kind": "event", "role": "secondary" }
  ],
  "roles": ["politician-official", "scientist-scholar"],
  "themes": {
    "primary": "diplomacy-foreign-policy",
    "secondary": ["war-war-crimes", "genocide-mass-killing", "intelligence-covert-ops", "weapons-arms-trade"]
  },
  "regions": {
    "origin": ["DE", "US"],
    "setting": ["KH", "VN", "BD", "LA", "TL", "US"],
    "subdivisions": [],
    "polities": ["nazi-germany"],
    "scope": "global"
  },
  "time": {
    "main_span": { "start": 1969, "end": 1977 },
    "covered_span": { "start": 1923, "end": 2022 },
    "reaches_present": true,
    "approximate": false
  },
  "summary": "German-born US National Security Advisor and Secretary of State Henry Kissinger helped prolong the Vietnam War, directed the secret bombing of Cambodia and Laos, and backed mass killings in Bangladesh and East Timor in the 1960s-70s.",
  "content_warnings": ["mass-atrocity"],
  "keywords": ["Operation Menu", "Paris Peace Accords", "Blood Telegram", "Archer Blood", "Nobel Peace Prize", "Furth", "Yom Kippur War", "Angolan Civil War", "Chile coup", "Team B"],
  "guests": ["Dave Anthony", "Gareth Reynolds"],
  "confidence": { "subjects": "high", "roles": "medium", "themes": "medium", "regions": "medium", "time": "medium" },
  "evidence": [
    { "facet": "time", "part": 1, "at": "00:08:24", "note": "Born 1923 in Furth, Germany, to a Jewish family" },
    { "facet": "regions", "part": 1, "at": "00:27:17", "note": "Family flees Nazi Germany for New York in 1938" },
    { "facet": "themes", "part": 2, "at": "00:08:01", "note": "Nuclear Weapons and Foreign Policy book and CFR report push limited nuclear war" },
    { "facet": "time", "part": 2, "at": "00:59:14", "note": "1968: he leaks Paris peace-talk details to the Nixon campaign" },
    { "facet": "time", "part": 2, "at": "01:19:46", "note": "Nixon names him National Security Advisor" },
    { "facet": "regions", "part": 3, "at": "00:11:40", "note": "Secret B-52 bombing of Cambodia planned and falsified via his office" },
    { "facet": "regions", "part": 3, "at": "00:48:22", "note": "Death tolls in Cambodia and Laos, unexploded ordnance still killing people" },
    { "facet": "regions", "part": 4, "at": "00:35:17", "note": "Operation Searchlight in East Pakistan while US backs Yahya Khan" },
    { "facet": "themes", "part": 5, "at": "00:28:17", "note": "FBI wiretap program on staff and journalists after the Cambodia leak" },
    { "facet": "regions", "part": 5, "at": "01:07:08", "note": "Ford and Kissinger visit Jakarta on eve of East Timor invasion" },
    { "facet": "themes", "part": 6, "at": "00:28:34", "note": "Pushes CIA covert funding of FNLA and UNITA in Angola" },
    { "facet": "time", "part": 6, "at": "01:33:29", "note": "Legacy: centralized executive war powers still shaping US foreign policy" }
  ],
  "notes": "Kissinger was alive at release (died 2023), so covered_span ends 2022. Setting capped at 6; Germany (childhood), Chile, Angola, Pakistan, India, China, Egypt/Israel, Rhodesia and Iraq also get segments. Roles: academic years at Harvard justify scientist-scholar; political-operative (1968 leak) was a close alternative."
}
