{
  "story_id": "constructing-the-crack-epidemic",
  "taxonomy_version": "0.4.0",
  "tagged_by": {
    "agent": "gold-draft",
    "model": "claude-opus-5-5",
    "date": "2026-10-16"
  },
  "format": "deep-dive",
  "subjects": [
    {
      "name": "Crack epidemic in the United States",
      "kind": "event",
      "role": "primary",
      "wikidata": "Q1758527"
    },
    {
      "name": "Central Intelligence Agency",
      "kind": "organization",
      "org_type": "intelligence",
      "role": "secondary",
      "wikidata": "Q37230"
    },
    {
      "name": "Iran-Contra affair",
      "kind": "event",
      "role": "secondary",
      "wikidata": "Q273659"
    },
    {
      "name": "Oliver North",
      "kind": "person",
      "role": "secondary",
      "lifespan": {
        "start": 1943,
        "end": null
      },
      "wikidata": "Q431223"
    },
    {
      "name": "Gary Webb",
      "kind": "person",
      "role": "secondary",
      "lifespan": {
        "start": 1955,
        "end": 2004
      },
      "wikidata": "Q1346239"
    }
  ],
  "roles": [],
  "themes": {
    "primary": "drugs",
    "secondary": [
      "intelligence-covert-ops",
      "moral-panics",
      "racism-white-supremacy",
      "propaganda-media",
      "weapons-arms-trade",
      "policing-incarceration"
    ]
  },
  "regions": {
    "origin": ["US"],
    "setting": ["US", "NI", "IR", "LB", "SV", "PA"],
    "subdivisions": [],
    "polities": [],
    "scope": "international"
  },
  "time": {
    "covered_span": {
      "start": 1981,
      "end": 1998
    },
    "main_span": {
      "start": 1981,
      "end": 1996
    },
    "reaches_present": false,
    "approximate": false
  },
  "summary": "Five-part series on how the 1980s US crack epidemic intersected with CIA-tolerated Contra cocaine smuggling, the Iran-Contra arms scheme run by Oliver North, a racialized media panic and harsh sentencing, and the 1996 discrediting of journalist Gary Webb.",
  "content_warnings": ["drug-use", "suicide-self-harm"],
  "keywords": [
    "Cracktoberfest",
    "Dark Alliance",
    "San Jose Mercury News",
    "Ronald Reagan",
    "Contras",
    "Boland Amendment",
    "Manuel Noriega",
    "crack babies",
    "100-to-1 sentencing disparity",
    "Kerry Committee report"
  ],
  "guests": ["Propaganda"],
  "confidence": {
    "subjects": "high",
    "roles": "medium",
    "themes": "high",
    "regions": "medium",
    "time": "medium"
  },
  "evidence": [
    {
      "facet": "time",
      "part": 1,
      "at": "00:41:38",
      "note": "crack reaches US inner cities in 1981, starting in southern California"
    },
    {
      "facet": "time",
      "part": 2,
      "at": "00:07:27",
      "note": "1981 CIA cable warns that new Contra allies ran a trial cocaine flight to Miami"
    },
    {
      "facet": "time",
      "part": 1,
      "at": "01:10:32",
      "note": "Webb's Dark Alliance series appears in August 1996"
    },
    {
      "facet": "time",
      "part": 5,
      "at": "00:45:01",
      "note": "CIA inspector general findings on Contra drug ties, the latest period covered at length"
    },
    {
      "facet": "themes",
      "part": 1,
      "at": "00:46:59",
      "note": "small crack-baby study inflated by the press into a moral panic over Black mothers"
    },
    {
      "facet": "themes",
      "part": 1,
      "at": "00:57:58",
      "note": "100-to-1 crack sentencing rule as racist policy driving Black incarceration"
    },
    {
      "facet": "themes",
      "part": 1,
      "at": "00:28:32",
      "note": "housing discrimination, job loss and welfare rules that hit Black inner cities before crack"
    },
    {
      "facet": "themes",
      "part": 2,
      "at": "00:22:52",
      "note": "CIA drug-funding history: Marseille heroin docks, then Golden Triangle opium"
    },
    {
      "facet": "regions",
      "part": 3,
      "at": "00:27:06",
      "note": "Beirut Marine barracks bombing and Hezbollah hostages in Lebanon"
    },
    {
      "facet": "regions",
      "part": 2,
      "at": "00:40:23",
      "note": "North-controlled hangar at Ilopango, El Salvador, used by a Contra pilot moving cocaine"
    },
    {
      "facet": "regions",
      "part": 5,
      "at": "00:03:14",
      "note": "Noriega's Panama drug network and his offer to sabotage Nicaragua for North"
    },
    {
      "facet": "regions",
      "part": 4,
      "at": "00:23:38",
      "note": "McFarlane and North fly to Tehran in 1986 to negotiate directly"
    }
  ],
  "notes": "Parts 3-4 are Prop's Hood Politics crossover, but formats.yaml lists Cracktoberfest as deep-dive. Roles empty: primary is an event. covered_span ends with the CIA IG review (1998); Webb's 2004 suicide is a short coda (p5 00:49:49). weapons-arms-trade and policing-incarceration restored after cap lift; war-war-crimes left out (Contra fighting itself gets little time). Coca/CIA heroin history (1855-1970s) under 5% of airtime."
}
