{
  "story_id": "basil-zaharoff-the-man-who-sold-world-war-one",
  "taxonomy_version": "0.5.0",
  "tagged_by": {
    "agent": "btb-tagger",
    "model": "claude-opus-5-5",
    "date": "2026-10-16"
  },
  "format": "deep-dive",
  "subjects": [
    {
      "name": "Basil Zaharoff",
      "kind": "person",
      "role": "primary",
      "lifespan": { "start": 1849, "end": 1936 }
    },
    {
      "name": "Vickers",
      "kind": "organization",
      "org_type": "company",
      "role": "secondary"
    }
  ],
  "roles": ["business-executive", "con-artist"],
  "themes": {
    "primary": "weapons-arms-trade",
    "secondary": [
      "war-war-crimes",
      "fraud-grift",
      "corporate-malfeasance",
      "diplomacy-foreign-policy",
      "propaganda-media"
    ]
  },
  "regions": {
    "origin": ["TR"],
    "setting": ["FR", "RU", "GB", "TR", "US", "GR"],
    "subdivisions": [],
    "polities": ["british-empire", "russian-empire", "ottoman-empire"],
    "scope": "global"
  },
  "time": {
    "main_span": { "start": 1877, "end": 1922 },
    "covered_span": { "start": 1849, "end": 1936 },
    "reaches_present": false,
    "approximate": false
  },
  "summary": "Ottoman-born Greek con man Basil Zaharoff became the leading salesman for Nordenfelt, Maxim and Vickers, stoking arms races and bribing officials across Europe in the decades before and during World War One.",
  "content_warnings": [],
  "keywords": [
    "Merchant of Death",
    "Nordenfelt",
    "Maxim gun",
    "Hiram Maxim",
    "System Zaharoff",
    "Krupp",
    "Schneider-Creusot",
    "Briey basin",
    "Duchess of Villafranca",
    "Monte Carlo"
  ],
  "guests": ["Teresa Lee"],
  "confidence": {
    "subjects": "high",
    "roles": "high",
    "themes": "high",
    "regions": "medium",
    "time": "medium"
  },
  "evidence": [
    {
      "facet": "time",
      "part": 1,
      "at": "00:06:26",
      "note": "birth in Anatolia (Mugla) to Greek parents posing as Russians; year from general knowledge"
    },
    {
      "facet": "themes",
      "part": 1,
      "at": "00:21:00",
      "note": "bigamous marriage in England, embezzlement trial and extradition from Belgium"
    },
    {
      "facet": "regions",
      "part": 1,
      "at": "00:36:34",
      "note": "years of scams and a second bigamous marriage in the United States"
    },
    {
      "facet": "time",
      "part": 1,
      "at": "00:41:17",
      "note": "Nordenfelt had first hired him as a salesman in 1877; rejoins in the mid-1880s"
    },
    {
      "facet": "themes",
      "part": 1,
      "at": "00:47:06",
      "note": "submarine sales to Greece, Turkey and Russia that spark an arms race"
    },
    {
      "facet": "regions",
      "part": 2,
      "at": "00:04:54",
      "note": "French loans fund Russian rearmament won by Vickers; Paris newspapers used as propaganda"
    },
    {
      "facet": "themes",
      "part": 2,
      "at": "00:13:09",
      "note": "Snowden's 1914 Commons speech on arms firms owning officials; bribery in Russia"
    },
    {
      "facet": "regions",
      "part": 2,
      "at": "00:34:35",
      "note": "Briey iron basin left unshelled during the war through his influence"
    },
    {
      "facet": "time",
      "part": 2,
      "at": "00:41:53",
      "note": "role in the 1920-22 Greco-Turkish war, then decline at Vickers and death in 1936"
    }
  ],
  "notes": "main_span runs from his first Nordenfelt job (1877) to the Greco-Turkish war (1922), the end of his influence; his decline and death to 1936 are in covered_span. Setting puts France first as the main WWI theatre he profited from; Russia is where his biggest sales and their debt consequences played out. Vickers also stands in for the Maxim and Nordenfelt firms."
}
